Microsoft Windows [版本 10.0.17134.345]
(c) 2018 Microsoft Corporation。保留所有权利。

C:\WINDOWS\system32>mysql -u root -p
Enter password: ********
Welcome to the MySQL monitor.  Commands end with ; or \g.
Your MySQL connection id is 12
Server version: 8.0.12 MySQL Community Server - GPL

Copyright (c) 2000, 2018, Oracle and/or its affiliates. All rights reserved.

Oracle is a registered trademark of Oracle Corporation and/or its
affiliates. Other names may be trademarks of their respective
owners.

Type 'help;' or '\h' for help. Type '\c' to clear the current input statement.

mysql> create database shoppingcar;
Query OK, 1 row affected (0.06 sec)

mysql> use shoppingcar;
Database changed
mysql> show databases;
+--------------------+
| Database           |
+--------------------+
| car                |
| information_schema |
| langlang           |
| m                  |
| mu                 |
| mysql              |
| performance_schema |
| shop               |
| shoppingcar        |
| sys                |
| wy                 |
| wy1                |
+--------------------+
12 rows in set (0.00 sec)

mysql> create table shopping(id int(11) primary key not null auto_increment,name varchar(20) not null,num int(3) default 1);
Query OK, 0 rows affected (0.08 sec)

mysql> desc shopping;
+-------+-------------+------+-----+---------+----------------+
| Field | Type        | Null | Key | Default | Extra          |
+-------+-------------+------+-----+---------+----------------+
| id    | int(11)     | NO   | PRI | NULL    | auto_increment |
| name  | varchar(20) | NO   |     | NULL    |                |
| num   | int(3)      | YES  |     | 1       |                |
+-------+-------------+------+-----+---------+----------------+
3 rows in set (0.01 sec)

mysql> alter table shopping add love varchar(6) not null;
Query OK, 0 rows affected (0.13 sec)
Records: 0  Duplicates: 0  Warnings: 0

mysql> alter table shopping add discount varchar(10) not null;
Query OK, 0 rows affected (0.06 sec)
Records: 0  Duplicates: 0  Warnings: 0

mysql> alter table shopping add wishes varchar(30
    -> ;
ERROR 1064 (42000): You have an error in your SQL syntax; check the manual that corresponds to your MySQL server version for the right syntax to use near '' at line 1
mysql> alter table shopping add wishes vaechar(30) not null;
ERROR 1064 (42000): You have an error in your SQL syntax; check the manual that corresponds to your MySQL server version for the right syntax to use near 'vaechar(30) not null' at line 1
mysql> alter table shopping add wishes vaechar(15) not null;
ERROR 1064 (42000): You have an error in your SQL syntax; check the manual that corresponds to your MySQL server version for the right syntax to use near 'vaechar(15) not null' at line 1
mysql> alter table shopping add wishes varchar(15) not null;
Query OK, 0 rows affected (0.10 sec)
Records: 0  Duplicates: 0  Warnings: 0

mysql> desc shopping;
+----------+-------------+------+-----+---------+----------------+
| Field    | Type        | Null | Key | Default | Extra          |
+----------+-------------+------+-----+---------+----------------+
| id       | int(11)     | NO   | PRI | NULL    | auto_increment |
| name     | varchar(20) | NO   |     | NULL    |                |
| num      | int(3)      | YES  |     | 1       |                |
| love     | varchar(6)  | NO   |     | NULL    |                |
| discount | varchar(10) | NO   |     | NULL    |                |
| wishes   | varchar(15) | NO   |     | NULL    |                |
+----------+-------------+------+-----+---------+----------------+
6 rows in set (0.00 sec)

mysql> insert into shopping (id,name,num,love,discount,wishes)values(1,'wangying','10','tie','3','buy tie');
Query OK, 1 row affected (0.06 sec)

mysql> insert into shopping (name,num,love,discount,wishes)values('wangyue',null,'water','5','buy'),('wangle',null,'eat','2','play');
Query OK, 2 rows affected (0.06 sec)
Records: 2  Duplicates: 0  Warnings: 0

mysql> select * from shopping;
+----+----------+------+-------+----------+---------+
| id | name     | num  | love  | discount | wishes  |
+----+----------+------+-------+----------+---------+
|  1 | wangying |   10 | tie   | 3        | buy tie |
|  2 | wangyue  | NULL | water | 5        | buy     |
|  3 | wangle   | NULL | eat   | 2        | play    |
+----+----------+------+-------+----------+---------+
3 rows in set (0.00 sec)

mysql> delete from shopping where id=1;
Query OK, 1 row affected (0.07 sec)

mysql> select * from shopping;
+----+---------+------+-------+----------+--------+
| id | name    | num  | love  | discount | wishes |
+----+---------+------+-------+----------+--------+
|  2 | wangyue | NULL | water | 5        | buy    |
|  3 | wangle  | NULL | eat   | 2        | play   |
+----+---------+------+-------+----------+--------+
2 rows in set (0.00 sec)

mysql>
